{
  "$schema": "../../data/schema/measurement.schema.json",
  "schema_version": "1.0.0",
  "measurement_id": "GS-2026-0001",
  "record_version": "1.0.0",
  "publication_status": "published",
  "title": "Audio Technica OC9XML - Rega P3 RB330 - Neo PSU MKII - Audio Research SP20",
  "slug": "Rega P3 / RB330 / Audio-Technica AT-OC9XML / Audio Research SP20 — 1 kHz Reference Check",
  "language": "en",
  "measurement_datetime_local": "2026-07-12T22:04:00",
  "measurement_timezone": "not_recorded",
  "date_published": "2026-08-29",
  "creator": {
    "name": "Michelangelo Canonico",
    "role": "Creator and lead measurer",
    "affiliation": "Direct Sound Records"
  },
  "publisher": {
    "name": "Direct Sound Records",
    "url": "https://directsoundrecords.com/",
    "location_label": "London–Rome"
  },
  "software": {
    "name": "Groove Scope",
    "report_generator_label": "Groove Scope Reference",
    "application_version": "not_recorded",
    "analysis_method_version": "not_recorded",
    "platform": "not_recorded",
    "developer": "Michelangelo Canonico / Direct Sound Records"
  },
  "related_applications": [
    {
      "name": "Resonance Lab",
      "relationship": "Companion application for tonearm and cartridge resonance planning",
      "url": "https://directsoundrecords.com/resonance-lab/"
    }
  ],
  "measurement_type": "1 kHz Reference Check",
  "measurement_scope": [
    "playback speed",
    "rotational stability",
    "DIN-weighted wow and flutter",
    "channel balance",
    "crosstalk",
    "distortion",
    "harmonic profile",
    "relative residual noise"
  ],
  "setup": {
    "turntable": "Rega P3",
    "tonearm": "Rega RB330",
    "cartridge": "Audio-Technica AT-OC9XML",
    "stylus": "Nude Microlinear diamond",
    "cartridge_hours": "not_recorded",
    "vertical_tracking_force_g": "not_recorded",
    "anti_skate_setting": "not_recorded",
    "alignment_geometry": "not_recorded",
    "azimuth_setting": "not_recorded",
    "vta_or_sra_setting": "not_recorded",
    "phono_stage": "Audio Research SP20 integrated phono stage",
    "phono_gain_db": "not_recorded",
    "cartridge_loading": "not_recorded",
    "test_record": "not_recorded",
    "test_record_track": "not_recorded",
    "test_record_condition": "not_recorded",
    "nominal_test_tone_hz": 1000,
    "audio_interface": "EVO4",
    "interface_gain_settings": "not_recorded",
    "sample_rate_hz": "not_recorded",
    "bit_depth": "not_recorded",
    "capture_device": "not_recorded",
    "channel_routing": "not_recorded",
    "measurement_location": "not_recorded",
    "turntable_power_supply": "Rega Neo PSU MK2",
    "cartridge_type": "moving_coil"
  },
  "results": {
    "settled_test_tone_frequency_hz": {
      "value": 992.88,
      "classification": "stable_primary"
    },
    "playback_speed_error_percent": {
      "value": -0.71,
      "classification": "stable_primary",
      "direction": "slow"
    },
    "calculated_rpm": {
      "value": 33.1,
      "classification": "stable_primary",
      "condition": "under_stylus_load"
    },
    "settled_rpm": {
      "minimum": 32.63,
      "maximum": 33.55,
      "span": 0.93,
      "classification": "stable_primary"
    },
    "din_weighted_wow_flutter_percent": {
      "value": 0.045,
      "classification": "stable_primary"
    },
    "raw_speed_variation_percent": {
      "rms_plus_minus": 0.358,
      "two_sigma_plus_minus": 0.716,
      "classification": "unweighted_diagnostic"
    },
    "raw_wow_flutter_percent": {
      "wow_rms": 0.186,
      "flutter_rms": 0.287,
      "classification": "unweighted_diagnostic"
    },
    "channel_balance_db": {
      "value": -0.63,
      "classification": "diagnostic_only",
      "report_label": "moderate imbalance"
    },
    "crosstalk_1khz_db": {
      "average_separation": 30.4,
      "left_to_right": -27.7,
      "right_to_left": -33.1,
      "directional_difference": 5.4,
      "classification": "supporting_repeat_directional_values"
    },
    "thd_percent": {
      "left": 0.37,
      "right": 0.34,
      "left_minus_right_percentage_points": 0.03,
      "combined": 0.31,
      "classification": "channel_values_diagnostic_combined_supporting"
    },
    "harmonic_profile_db": {
      "h2": {
        "left": -48.7,
        "right": -49.7,
        "left_minus_right": 0.9
      },
      "h3": {
        "left": -64.4,
        "right": -63.2,
        "left_minus_right": -1.2
      },
      "h4": {
        "left": -72.5,
        "right": -70.5,
        "left_minus_right": -2.0
      },
      "h5": {
        "left": -79.6,
        "right": -82.0,
        "left_minus_right": 2.4
      },
      "classification": "diagnostic_only"
    },
    "relative_residual_noise_db": {
      "value": 14.8,
      "classification": "diagnostic_only",
      "reference": "extracted fundamental",
      "not_equivalent_to": "A-weighted bench noise measurement"
    }
  },
  "interpretation": {
    "summary": "Playback speed and rotational stability were measured consistently during this capture. Channel-specific distortion, harmonic, balance, and directional 1 kHz measurements require repetition before mechanical adjustment.",
    "recommendation": "Confirm the speed result with another valid capture, then correct the deck speed if the same error repeats. Repeat variable diagnostics before adjusting anti-skate, zenith, azimuth, VTA, or VTF.",
    "repeat_required": true
  },
  "provenance": {
    "source_type": "Groove Scope generated PDF report",
    "source_file": "report.pdf",
    "data_entry_method": "Values transcribed from the source report and independently represented as structured JSON",
    "raw_audio_published": false,
    "raw_audio_note": "No raw test-record audio is included in this record.",
    "known_limitations": [
      "The actual SP20 phono loading used for this capture was not recorded.",
      "The test-record edition/track, capture format, Groove Scope application version, and analysis-method version remain to be documented.",
      "This is a single-session observation.",
      "Directional and channel-specific diagnostics require repetition before setup changes."
    ],
    "setup_metadata_source": "Equipment identification supplied by Michelangelo Canonico on 2026-07-24; the tonearm was subsequently confirmed as a Rega RB330. Stylus profile was normalized from the manufacturer model specification."
  },
  "files": {
    "human_readable_record": "README.md",
    "source_report": "report.pdf",
    "checksums": "checksums.sha256"
  },
  "license": "CC-BY-4.0",
  "keywords": [
    "Groove Scope",
    "Direct Sound Records",
    "Michelangelo Canonico",
    "Resonance Lab",
    "vinyl measurement",
    "turntable speed",
    "wow and flutter",
    "cartridge crosstalk",
    "vinyl distortion",
    "1 kHz reference check",
    "Rega P3",
    "Rega Neo PSU MK2",
    "Audio-Technica AT-OC9XML",
    "Audio Research SP20",
    "Microlinear stylus",
    "Rega RB330"
  ]
}
